id,name,brand_name,category_name,sub_category_name,slug,thumb_image,qty,sku,price,offer_price,offer_start_price,offer_end_price,product_type,status,is_approved,short_description,long_description,seo_title,seo_description,created_at
183,"Xiaomi POCO X7 5G Smartphone",Xiaomi,"Mobile Phones",Phone,xiaomi-poco-x7-5g-smartphone,"uploads/2026-03-14_1773516285_69b5b5fd49388_Xiaomi POCO X7 5G Smartphone.jpg",68,XIA-MOB-PHN-025,349,309,2026-03-08,2026-03-29,featured,1,1,"<b>Xiaomi POCO X7 5G Smartphone</b><p>Performance focused smartphone designed for fast multitasking and responsive everyday mobile use.</p>","<b>Xiaomi POCO X7 5G Smartphone</b><p>This smartphone is built for customers who want strong day to day performance, modern design, and useful 5G support. It handles entertainment, gaming, messaging, and app switching with practical speed and good overall value.</p><p>A solid POCO model for active mobile users.</p>","Xiaomi POCO X7 5G Smartphone","Buy Xiaomi POCO X7 5G Smartphone with fast everyday performance and modern 5G support.","2026-03-14 13:26:40"
184,"Xiaomi POCO X7 Pro 5G Smartphone",Xiaomi,"Mobile Phones",Phone,xiaomi-poco-x7-pro-5g-smartphone,"uploads/2026-03-14_1773516330_69b5b62a55a46_Xiaomi POCO X7 Pro 5G Smartphone.jpg",58,XIA-MOB-PHN-026,429,389,2026-03-08,2026-03-29,best,1,1,"<b>Xiaomi POCO X7 Pro 5G Smartphone</b><p>High performance smartphone built for speed, gaming, and advanced daily mobile tasks.</p>","<b>Xiaomi POCO X7 Pro 5G Smartphone</b><p>This phone is made for users who want stronger performance for gaming, streaming, and fast multitasking with stable 5G connectivity. It combines practical power with sharp modern styling for a more advanced Xiaomi mobile experience.</p><p>A compelling device for users who prioritize speed and value.</p>","Xiaomi POCO X7 Pro 5G Smartphone","Shop Xiaomi POCO X7 Pro 5G Smartphone with high performance hardware and strong daily 5G usability.","2026-03-14 13:26:40"
185,"Xiaomi Redmi 13C Smartphone",Xiaomi,"Mobile Phones",Phone,xiaomi-redmi-13c-smartphone,"uploads/2026-03-14_1773516357_69b5b6454c42f_Xiaomi Redmi 13C Smartphone.jpg",90,XIA-MOB-PHN-027,159,139,2026-03-08,2026-03-29,top,1,1,"<b>Xiaomi Redmi 13C Smartphone</b><p>Affordable smartphone designed for simple daily communication and reliable basic mobile use.</p>","<b>Xiaomi Redmi 13C Smartphone</b><p>This phone is suitable for customers who want an accessible smartphone for calls, messaging, light browsing, and daily convenience. It offers practical Xiaomi usability in a straightforward and budget friendly format.</p><p>A sensible entry level option for essential smartphone needs.</p>","Xiaomi Redmi 13C Smartphone","Shop Xiaomi Redmi 13C Smartphone for affordable daily communication and essential mobile tasks.","2026-03-14 13:26:40"
186,"Apple iPhone X Smartphone",Apple,"Mobile Phones",Phone,apple-iphone-x-smartphone,uploads/2026-03-15_1773584334_69b6bfcec4a98_iphonex.png,55,APP-MOB-PHN-028,899,839,2026-03-08,2026-03-29,featured,1,1,"<b>Apple iPhone X Smartphone</b><p>Modern iPhone designed for smooth performance, premium build quality, and dependable everyday mobile use.</p>","<b>Apple iPhone X Smartphone</b><p>This smartphone offers the refined Apple user experience with smooth daily performance, quality display, and reliable camera support for communication, content, and app use. It is ideal for customers who want a premium mainstream iPhone model.</p><p>A practical flagship level Apple device for modern daily routines.</p>","Apple iPhone X Smartphone","Shop Apple iPhone X Smartphone with premium performance and reliable everyday Apple usability.","2026-03-14 13:26:40"
187,"Apple iPhone 11 Plus Smartphone",Apple,"Mobile Phones",Phone,apple-iphone-11-plus-smartphone,"uploads/2026-03-14_1773516417_69b5b68128a2c_Apple iPhone 16 Plus Smartphone.webp",45,APP-MOB-PHN-029,999,939,2026-03-08,2026-03-29,featured,1,1,"<b>Apple iPhone 11 Plus Smartphone</b><p>Larger iPhone model designed for immersive screen viewing and smooth everyday performance.</p>","<b>Apple iPhone 11 Plus Smartphone</b><p>This iPhone offers a larger display area for customers who prefer more comfortable media viewing, messaging, and general daily use. It balances premium Apple styling with practical screen size and consistent performance.</p><p>A strong iPhone choice for users who value display space and polished usability.</p>","Apple iPhone 11 Plus Smartphone","Buy Apple iPhone 11 Plus Smartphone with larger display and premium Apple daily performance.","2026-03-14 13:26:40"
188,"Apple iPhone 17 Pro Smartphone",Apple,"Mobile Phones",Phone,apple-iphone-17-pro-smartphone,uploads/2026-03-15_1773585015_69b6c27777f83_iphone17.jpeg,40,APP-MOB-PHN-030,1099,1039,2026-03-08,2026-03-29,best,1,1,"<b>Apple iPhone 17 Pro Smartphone</b><p>Premium Pro iPhone built for advanced performance, professional feel, and everyday flagship use.</p>","<b>Apple iPhone 17 Pro Smartphone</b><p>This smartphone is designed for users who want stronger performance, a more premium Apple build, and enhanced daily capability for photography, productivity, and entertainment. It is a polished option within the iPhone Pro family.</p><p>A suitable device for customers who prefer a more advanced flagship experience.</p>","Apple iPhone 17 Pro Smartphone","Shop Apple iPhone 17 Pro Smartphone with premium Pro performance and advanced flagship design.","2026-03-14 13:26:40"
189,"Apple iPhone 16 Pro Max Smartphone",Apple,"Mobile Phones",Phone,apple-iphone-16-pro-max-smartphone,"uploads/2026-03-14_1773516493_69b5b6cd1def6_Apple iPhone 16 Pro Max Smartphone.jpg",35,APP-MOB-PHN-031,1199,1139,2026-03-08,2026-03-29,best,1,1,"<b>Apple iPhone 16 Pro Max Smartphone</b><p>Large premium iPhone designed for top tier performance, immersive viewing, and flagship daily use.</p>","<b>Apple iPhone 16 Pro Max Smartphone</b><p>This iPhone is built for customers who want the largest premium Apple phone experience with strong everyday performance, advanced mobile capability, and a more immersive display. It suits users who prioritize flagship level convenience and status.</p><p>A premium device for users seeking top-end Apple mobile hardware.</p>","Apple iPhone 16 Pro Max Smartphone","Buy Apple iPhone 16 Pro Max Smartphone with premium flagship performance and expansive display experience.","2026-03-14 13:26:40"
190,"Apple iPhone 15 Smartphone",Apple,"Mobile Phones",Phone,apple-iphone-15-smartphone,"uploads/2026-03-14_1773516528_69b5b6f02538c_Apple iPhone 15 Smartphone.webp",60,APP-MOB-PHN-032,799,749,2026-03-08,2026-03-29,featured,1,1,"<b>Apple iPhone 15 Smartphone</b><p>Modern iPhone designed for smooth daily communication, photography, and app performance.</p>","<b>Apple iPhone 15 Smartphone</b><p>This smartphone offers reliable Apple performance with smooth user experience, strong camera capability, and efficient battery usage. It is suitable for messaging, social media, entertainment, and everyday mobile tasks.</p><p>A balanced iPhone choice for customers who want premium quality and dependable daily performance.</p>","Apple iPhone 15 Smartphone","Shop Apple iPhone 15 Smartphone with premium Apple performance and everyday mobile reliability.","2026-03-14 13:34:31"
191,"Apple iPhone 15 Plus Smartphone",Apple,"Mobile Phones",Phone,apple-iphone-15-plus-smartphone,"uploads/2026-03-14_1773516558_69b5b70ee5916_Apple iPhone 15 Smartphone.webp",55,APP-MOB-PHN-033,899,839,2026-03-08,2026-03-29,top,1,1,"<b>Apple iPhone 15 Plus Smartphone</b><p>Large display iPhone designed for immersive viewing and comfortable daily use.</p>","<b>Apple iPhone 15 Plus Smartphone</b><p>This iPhone provides a larger display for streaming, messaging, browsing, and gaming. It combines Apple design quality with comfortable screen space and stable everyday performance.</p><p>A good option for customers who prefer larger smartphone displays.</p>","Apple iPhone 15 Plus Smartphone","Buy Apple iPhone 15 Plus Smartphone with large display and reliable Apple performance.","2026-03-14 13:34:31"
192,"Apple iPhone 12 Pro Smartphone",Apple,"Mobile Phones",Phone,apple-iphone-12-pro-smartphone,uploads/2026-03-15_1773584379_69b6bffb91537_iphone12.webp,50,APP-MOB-PHN-034,1099,1049,2026-03-08,2026-03-29,best,1,1,"<b>Apple iPhone 12 Pro Smartphone</b><p>Advanced iPhone designed for powerful performance and professional photography.</p>","<b>Apple iPhone 12 Pro Smartphone</b><p>This smartphone offers stronger processing performance, premium design, and high quality camera capability suitable for photography, gaming, and professional everyday use.</p><p>A flagship device for users who want top level Apple performance.</p>","Apple iPhone 12 Pro Smartphone","Shop Apple iPhone 12 Pro Smartphone with powerful performance and premium Apple design.","2026-03-14 13:34:31"
194,"Apple iPhone 13 Smartphone",Apple,"Mobile Phones",Phone,apple-iphone-13-smartphone,"uploads/2026-03-14_1773516691_69b5b79362c3c_Apple iPhone 13 Smartphone.jpg",80,APP-MOB-PHN-036,599,549,2026-03-08,2026-03-29,top,1,1,"<b>Apple iPhone 13 Smartphone</b><p>Popular iPhone model built for smooth daily mobile experience.</p>","<b>Apple iPhone 13 Smartphone</b><p>This smartphone remains a strong choice for everyday communication, photography, and entertainment. It offers dependable Apple performance and practical modern smartphone capability.</p><p>A solid value option in the Apple lineup.</p>","Apple iPhone 13 Smartphone","Shop Apple iPhone 13 Smartphone with dependable Apple performance and modern mobile features.","2026-03-14 13:34:31"
195,"Samsung Galaxy S24 Smartphone",Samsung,"Mobile Phones",Phone,samsung-galaxy-s24-smartphone,"uploads/2026-03-14_1773516728_69b5b7b84346c_Samsung Galaxy S24 Smartphone.jpg",70,SAM-MOB-PHN-037,899,839,2026-03-08,2026-03-29,featured,1,1,"<b>Samsung Galaxy S24 Smartphone</b><p>Modern Samsung smartphone designed for performance, photography, and smooth daily use.</p>","<b>Samsung Galaxy S24 Smartphone</b><p>This smartphone offers fast performance, high quality display, and versatile camera capability. It is suitable for communication, productivity, entertainment, and advanced mobile usage.</p><p>A flagship Samsung device for everyday modern smartphone users.</p>","Samsung Galaxy S24 Smartphone","Shop Samsung Galaxy S24 Smartphone with powerful performance and premium display experience.","2026-03-14 13:34:31"
196,"Samsung Galaxy S24 Plus Smartphone",Samsung,"Mobile Phones",Phone,samsung-galaxy-s24-plus-smartphone,"uploads/2026-03-14_1773516767_69b5b7df12781_Samsung Galaxy S24 Plus Smartphone.jpg",60,SAM-MOB-PHN-038,999,939,2026-03-08,2026-03-29,best,1,1,"<b>Samsung Galaxy S24 Plus Smartphone</b><p>Large screen Samsung smartphone designed for immersive entertainment and productivity.</p>","<b>Samsung Galaxy S24 Plus Smartphone</b><p>This smartphone provides a large display suitable for streaming, browsing, gaming, and multitasking. It combines Samsung performance with modern flagship design.</p><p>A strong option for users who want a larger Samsung flagship device.</p>","Samsung Galaxy S24 Plus Smartphone","Buy Samsung Galaxy S24 Plus Smartphone with large display and flagship performance.","2026-03-14 13:34:31"
197,"Samsung Galaxy S25 Ultra Smartphone",Samsung,"Mobile Phones",Phone,samsung-galaxy-s25-ultra-smartphone,uploads/2026-03-15_1773586558_69b6c87ec4596_1760541649-samsung-galaxy-s25-fe-68efbbaacb80b.jpg,50,SAM-MOB-PHN-039,1199,1129,2026-03-08,2026-03-29,best,1,1,"<b>Samsung Galaxy S25 Ultra Smartphone</b><p>Premium Samsung flagship smartphone designed for advanced photography and high performance.</p>","<b>Samsung Galaxy S25 Ultra Smartphone</b><p>This flagship device offers powerful hardware, advanced camera technology, and large display capability for professional level smartphone use.</p><p>A top tier Samsung device for users who want maximum performance.</p>","Samsung Galaxy S25 Ultra Smartphone","Shop Samsung Galaxy S25 Ultra Smartphone with powerful flagship performance.","2026-03-14 13:34:31"
198,"Samsung Galaxy Z Flip 3 Smartphone",Samsung,"Mobile Phones",Phone,samsung-galaxy-z-flip-3-smartphone,uploads/2026-03-15_1773586433_69b6c801ca6ff_Samsung-Galaxy-Z-Flip-3-5G-128GB-Factory-Unlocked-Cellphone_a75abc76-bc49-4fb6-b5f7-55ec89dfeb3b.e1db538ed44b4b1eeb37c8d6ebb3aa65.jpeg.webp,80,SAM-MOB-PHN-040,699,649,2026-03-08,2026-03-29,top,1,1,"<b>Samsung Galaxy Z Flip 3 Smartphone</b><p>Balanced Samsung smartphone designed for daily communication and entertainment.</p>","<b>Samsung Galaxy Z Filp 3 Smartphone</b><p>This smartphone provides reliable Samsung performance with clear display quality and strong everyday usability.</p><p>A solid option for customers who want dependable Samsung smartphone performance.</p>","Samsung Galaxy Z Flip 3 Smartphone","Buy Samsung Galaxy Z Flip 3 Smartphone with dependable performance and modern mobile capability.","2026-03-14 13:34:31"
199,"Samsung Galaxy Z Flip 6 Smartphone",Samsung,"Mobile Phones",Phone,samsung-galaxy-z-flip-6-smartphone,"uploads/2026-03-14_1773516864_69b5b840cdacd_Samsung Galaxy Z Flip 6 Smartphone.jpg",45,SAM-MOB-PHN-041,1099,1039,2026-03-08,2026-03-29,featured,1,1,"<b>Samsung Galaxy Z Flip 6 Smartphone</b><p>Foldable Samsung smartphone designed for modern style and innovative mobile experience.</p>","<b>Samsung Galaxy Z Flip 6 Smartphone</b><p>This smartphone features a foldable display and premium Samsung design suitable for users who want unique smartphone styling and strong everyday performance.</p><p>A fashionable flagship Samsung device for modern smartphone users.</p>","Samsung Galaxy Z Flip 6 Smartphone","Shop Samsung Galaxy Z Flip 6 Smartphone with innovative foldable display and premium design.","2026-03-14 13:34:31"
200,"Samsung Galaxy S24 FE Smartphone",Samsung,"Mobile Phones",Phone,samsung-galaxy-s24-fe-smartphone,"uploads/2026-03-14_1773516901_69b5b865149f7_Samsung Galaxy S24 FE Smartphone.webp",75,SAM-MOB-PHN-042,649,599,2026-03-08,2026-03-29,top,1,1,"<b>Samsung Galaxy S24 FE Smartphone</b><p>Fan edition Samsung smartphone built for balanced performance and everyday reliability.</p>","<b>Samsung Galaxy S24 FE Smartphone</b><p>This smartphone offers flagship inspired features with practical pricing and dependable daily performance for communication, entertainment, and productivity.</p><p>A strong option for Samsung fans looking for value.</p>","Samsung Galaxy S24 FE Smartphone","Buy Samsung Galaxy S24 FE Smartphone with reliable Samsung performance and modern design.","2026-03-14 13:34:31"
201,"Apple iPad 11th Generation Tablet",Apple,"Mobile Phones",Tablet,apple-ipad-11th-generation-tablet,"uploads/2026-03-14_1773516922_69b5b87a27aef_Apple iPad 11th Generation Tablet.webp",60,APP-TAB-043,449,419,2026-03-08,2026-03-29,featured,1,1,"<b>Apple iPad 11th Generation Tablet</b><p>Versatile tablet designed for productivity, entertainment, and everyday digital tasks.</p>","<b>Apple iPad 11th Generation Tablet</b><p>This tablet delivers a smooth Apple experience for browsing, streaming, studying, and creative tasks. It features a responsive touchscreen and strong battery performance for daily use.</p><p>A reliable device for students, professionals, and casual tablet users.</p>","Apple iPad 11th Generation Tablet","Shop Apple iPad 10th Generation Tablet for productivity, entertainment, and everyday digital convenience.","2026-03-14 13:36:36"
202,"Apple iPad Air M2 Tablet",Apple,"Mobile Phones",Tablet,apple-ipad-air-m2-tablet,"uploads/2026-03-14_1773516954_69b5b89ab6706_Apple iPad Air M2 Tablet.jpg",55,APP-TAB-044,699,659,2026-03-08,2026-03-29,best,1,1,"<b>Apple iPad Air M2 Tablet</b><p>Powerful tablet designed for creativity, productivity, and advanced everyday use.</p>","<b>Apple iPad Air M2 Tablet</b><p>This tablet provides strong processing performance suitable for creative work, multitasking, and immersive media consumption.</p><p>A premium tablet choice for users who want powerful performance in a lightweight design.</p>","Apple iPad Air M2 Tablet","Buy Apple iPad Air M2 Tablet with powerful performance and sleek modern design.","2026-03-14 13:36:36"
203,"Apple iPad Mini 6 Tablet",Apple,"Mobile Phones",Tablet,apple-ipad-mini-6-tablet,"uploads/2026-03-14_1773516979_69b5b8b377cf7_Apple iPad Mini 6 Tablet.jpeg",50,APP-TAB-045,499,459,2026-03-08,2026-03-29,top,1,1,"<b>Apple iPad Mini 6 Tablet</b><p>Compact tablet designed for portability, reading, and casual productivity.</p>","<b>Apple iPad Mini 6 Tablet</b><p>This small form tablet offers excellent portability and strong Apple ecosystem integration for browsing, note taking, and travel convenience.</p><p>A great tablet option for users who prefer compact devices.</p>","Apple iPad Mini 6 Tablet","Shop Apple iPad Mini 6 Tablet with compact design and reliable everyday performance.","2026-03-14 13:36:36"
205,"Apple iPad Pro 13 Inch Tablet",Apple,"Mobile Phones",Tablet,apple-ipad-pro-13-inch-tablet,"uploads/2026-03-14_1773517005_69b5b8cdbd628_Apple iPad Pro 11 Inch Tablet.jpg",35,APP-TAB-047,1199,1129,2026-03-08,2026-03-29,best,1,1,"<b>Apple iPad Pro 13 Inch Tablet</b><p>Large premium tablet designed for professional productivity and immersive display experience.</p>","<b>Apple iPad Pro 13 Inch Tablet</b><p>This tablet features a large display and powerful hardware suitable for advanced creative work, productivity applications, and multimedia editing.</p><p>A flagship Apple tablet for demanding professional users.</p>","Apple iPad Pro 13 Inch Tablet","Shop Apple iPad Pro 13 Inch Tablet with powerful performance and large professional display.","2026-03-14 13:36:36"
206,"Samsung Galaxy Tab S10 Tablet",Samsung,"Mobile Phones",Tablet,samsung-galaxy-tab-s10-tablet,"uploads/2026-03-14_1773517492_69b5bab4ec214_Samsung Galaxy Tab S10 Tablet.jpeg",60,SAM-TAB-048,799,749,2026-03-08,2026-03-29,featured,1,1,"<b>Samsung Galaxy Tab S10 Tablet</b><p>Modern Android tablet designed for productivity and multimedia entertainment.</p>","<b>Samsung Galaxy Tab S10 Tablet</b><p>This tablet offers a bright display, responsive performance, and smooth Android multitasking capability.</p><p>A versatile Samsung tablet for everyday productivity and entertainment.</p>","Samsung Galaxy Tab S10 Tablet","Shop Samsung Galaxy Tab S10 Tablet with powerful performance and premium display.","2026-03-14 13:36:36"
207,"Samsung Galaxy Tab S10 Plus Tablet",Samsung,"Mobile Phones",Tablet,samsung-galaxy-tab-s10-plus-tablet,"uploads/2026-03-14_1773517516_69b5bacc53a60_Samsung Galaxy Tab S10 Tablet.jpg",55,SAM-TAB-049,999,949,2026-03-08,2026-03-29,best,1,1,"<b>Samsung Galaxy Tab S10 Plus Tablet</b><p>Large display tablet designed for multitasking and immersive entertainment.</p>","<b>Samsung Galaxy Tab S10 Plus Tablet</b><p>This tablet features a large high resolution display suitable for streaming, productivity tasks, and creative workflows.</p><p>A strong Samsung tablet for advanced daily use.</p>","Samsung Galaxy Tab S10 Plus Tablet","Buy Samsung Galaxy Tab S10 Plus Tablet with premium performance and large display.","2026-03-14 13:36:36"
208,"Samsung Galaxy Tab S9 FE Tablet",Samsung,"Mobile Phones",Tablet,samsung-galaxy-tab-s9-fe-tablet,"uploads/2026-03-14_1773517528_69b5bad86dd2a_Samsung Galaxy Tab S9 FE Tablet.webp",70,SAM-TAB-050,549,509,2026-03-08,2026-03-29,top,1,1,"<b>Samsung Galaxy Tab S9 FE Tablet</b><p>Fan edition tablet designed for reliable performance and everyday tasks.</p>","<b>Samsung Galaxy Tab S9 FE Tablet</b><p>This tablet offers balanced performance and a comfortable viewing experience suitable for study, browsing, and media consumption.</p><p>A practical Samsung tablet for daily digital activities.</p>","Samsung Galaxy Tab S9 FE Tablet","Shop Samsung Galaxy Tab S9 FE Tablet for everyday productivity and entertainment.","2026-03-14 13:36:36"
209,"Samsung Galaxy Tab A10 Tablet",Samsung,"Mobile Phones",Tablet,samsung-galaxy-tab-a10-tablet,"uploads/2026-03-14_1773517551_69b5baefad524_Samsung Galaxy Tab A10 Tablet.jpg",85,SAM-TAB-051,249,219,2026-03-08,2026-03-29,top,1,1,"<b>Samsung Galaxy Tab A10 Tablet</b><p>Affordable tablet designed for casual browsing and everyday digital use.</p>","<b>Samsung Galaxy Tab A10 Tablet</b><p>This tablet offers practical performance suitable for reading, streaming, browsing, and light productivity tasks.</p><p>A budget friendly Samsung tablet for daily use.</p>","Samsung Galaxy Tab A10 Tablet","Buy Samsung Galaxy Tab A9 Tablet for simple and reliable everyday tablet use.","2026-03-14 13:36:36"
210,"Samsung Galaxy Tab S8 Ultra Tablet",Samsung,"Mobile Phones",Tablet,samsung-galaxy-tab-s8-ultra-tablet,"uploads/2026-03-14_1773517577_69b5bb0947ede_Samsung Galaxy Tab S8 Ultra Tablet.jpg",40,SAM-TAB-052,1099,1039,2026-03-08,2026-03-29,best,1,1,"<b>Samsung Galaxy Tab S8 Ultra Tablet</b><p>High end Samsung tablet designed for creative professionals and advanced multitasking.</p>","<b>Samsung Galaxy Tab S8 Ultra Tablet</b><p>This flagship tablet offers a massive display, strong performance, and advanced multitasking capabilities for professional productivity and multimedia creation.</p><p>A powerful device for users who want a premium Android tablet experience.</p>","Samsung Galaxy Tab S8 Ultra Tablet","Shop Samsung Galaxy Tab S8 Ultra Tablet with flagship performance and ultra large display.","2026-03-14 13:36:36"
211,"Apple Watch Series 9 GPS Smartwatch",Apple,Electronics,"Smart Watch",apple-watch-series-9-gps-smartwatch,"uploads/2026-03-14_1773517598_69b5bb1ed01d3_Apple Watch Series 9 GPS Smartwatch.jpg",60,APP-SMT-053,399,369,2026-03-08,2026-03-29,featured,1,1,"<b>Apple Watch Series 9 GPS Smartwatch</b><p>Advanced smartwatch designed for fitness tracking, notifications, and seamless Apple ecosystem integration.</p>","<b>Apple Watch Series 9 GPS Smartwatch</b><p>This smartwatch offers accurate health tracking, activity monitoring, and smooth connectivity with Apple devices. It is suitable for fitness enthusiasts and everyday productivity.</p><p>A powerful smartwatch for modern daily lifestyles.</p>","Apple Watch Series 9 GPS Smartwatch","Buy Apple Watch Series 9 GPS Smartwatch for fitness tracking and smart notifications.","2026-03-14 13:53:52"
212,"Apple Watch Series 9 Cellular Smartwatch",Apple,Electronics,"Smart Watch",apple-watch-series-9-cellular-smartwatch,"uploads/2026-03-14_1773517670_69b5bb663d9c3_Apple Watch Series 9 Cellular Smartwatch.webp",50,APP-SMT-054,499,459,2026-03-08,2026-03-29,best,1,1,"<b>Apple Watch Series 9 Cellular Smartwatch</b><p>Premium smartwatch with independent cellular connectivity.</p>","<b>Apple Watch Series 9 Cellular Smartwatch</b><p>This smartwatch enables calling, messaging, and streaming without needing a nearby phone. Ideal for active lifestyles and fitness tracking.</p>","Apple Watch Series 9 Cellular Smartwatch","Shop Apple Watch Series 9 Cellular Smartwatch with advanced connectivity.","2026-03-14 13:53:52"
213,"Apple Watch Ultra 2 Smartwatch",Apple,Electronics,"Smart Watch",apple-watch-ultra-2-smartwatch,"uploads/2026-03-14_1773517696_69b5bb80714bb_Apple Watch Ultra 2 Smartwatch.jpg",35,APP-SMT-055,799,749,2026-03-08,2026-03-29,best,1,1,"<b>Apple Watch Ultra 2 Smartwatch</b><p>Rugged premium smartwatch designed for outdoor sports and extreme conditions.</p>","<b>Apple Watch Ultra 2 Smartwatch</b><p>This smartwatch offers long battery life, GPS accuracy, and durable construction for hiking, diving, and adventure activities.</p>","Apple Watch Ultra 2 Smartwatch","Shop Apple Watch Ultra 2 for adventure and outdoor performance.","2026-03-14 13:53:52"
214,"Apple Watch SE 2nd Generation Smartwatch",Apple,Electronics,"Smart Watch",apple-watch-se-2nd-generation-smartwatch,"uploads/2026-03-14_1773517723_69b5bb9bd45f2_Apple Watch SE 2nd Generation Smartwatch.jpg",70,APP-SMT-056,249,219,2026-03-08,2026-03-29,top,1,1,"<b>Apple Watch SE 2nd Generation Smartwatch</b><p>Affordable smartwatch with essential Apple fitness features.</p>","<b>Apple Watch SE 2nd Generation Smartwatch</b><p>This smartwatch delivers reliable activity tracking, notifications, and Apple ecosystem integration at an accessible price point.</p>","Apple Watch SE 2nd Generation Smartwatch","Buy Apple Watch SE 2nd Generation for affordable smart fitness tracking.","2026-03-14 13:53:52"
215,"Apple Watch Series 8 Smartwatch",Apple,Electronics,"Smart Watch",apple-watch-series-8-smartwatch,"uploads/2026-03-14_1773517753_69b5bbb9eff98_Apple Watch Series 8 Smartwatch.jpg",55,APP-SMT-057,429,389,2026-03-08,2026-03-29,featured,1,1,"<b>Apple Watch Series 8 Smartwatch</b><p>Reliable smartwatch designed for health monitoring and daily productivity.</p>","<b>Apple Watch Series 8 Smartwatch</b><p>This smartwatch offers advanced health features including heart monitoring, sleep tracking, and seamless integration with Apple devices.</p>","Apple Watch Series 8 Smartwatch","Shop Apple Watch Series 8 Smartwatch with powerful health monitoring features.","2026-03-14 13:53:52"
216,"Samsung Galaxy Watch 6 Smartwatch",Samsung,Electronics,"Smart Watch",samsung-galaxy-watch-6-smartwatch,"uploads/2026-03-14_1773517792_69b5bbe0c295e_Samsung Galaxy Watch 6 Smartwatch.jpg",65,SAM-SMT-058,329,299,2026-03-08,2026-03-29,featured,1,1,"<b>Samsung Galaxy Watch 6 Smartwatch</b><p>Modern smartwatch with advanced fitness tracking and smooth performance.</p>","<b>Samsung Galaxy Watch 6 Smartwatch</b><p>This smartwatch provides health monitoring, sleep tracking, and smart notifications for Android users.</p>","Samsung Galaxy Watch 6 Smartwatch","Buy Samsung Galaxy Watch 6 with advanced fitness tracking.","2026-03-14 13:53:52"
