id,name,brand_name,category_name,sub_category_name,slug,thumb_image,qty,sku,price,offer_price,offer_start_price,offer_end_price,product_type,status,is_approved,short_description,long_description,seo_title,seo_description,created_at
5,"Nestle Ready Meal Bento Box",Nestle,"Grocery & Food","Instant Food",nestle-ready-meal-bento-box,uploads/2026-03-09_1773056017_69aeb0119a74a_nestle-ready-meal-bento-box.jpeg,120,NES-GRO-BENTO-001,7,6,2026-03-01,2026-03-18,top,1,1,"<b>Instant Food</b><p>Convenient ready meal with balanced flavor and quick preparation for busy days.</p>","<b>Nestle Ready Meal Bento Box</b><p>This ready-to-eat meal offers a practical food option for lunch breaks, travel, and quick home dining. It is easy to prepare and designed for convenience without sacrificing taste.</p><p>Ideal for students, office workers, and customers looking for a fast and satisfying meal solution.</p>","Nestle Ready Meal Bento Box","Shop Nestle Ready Meal Bento Box for a quick and convenient instant food option.","2024-03-13 11:46:12"
6,"Nike Summer Cotton T-Shirt",Nike,Fashion,T-shirt,nike-summer-cotton-t-shirt,"uploads/2026-03-09_1773057158_69aeb486e0a5d_nike summer cotton t-shirt-2.jpg",120,NIK-FAS-TSH-001,25,20,2026-03-02,2026-03-20,featured,1,1,"<b>Summer T-Shirt</b><p>Breathable cotton t-shirt made for casual daily wear and warm weather comfort.</p>","<b>Nike Summer Cotton T-Shirt</b><p>This lightweight cotton t-shirt features a soft texture, clean everyday design, and comfortable regular fit. It is suitable for daily outfits, weekend activities, and casual streetwear styling.</p><p>Easy to pair with jeans, shorts, and sneakers for a relaxed modern look.</p>","Nike Summer Cotton T-Shirt","Shop Nike Summer Cotton T-Shirt with breathable fabric and casual everyday comfort.","2024-03-16 09:34:13"
7,"Selons Knit Sweater",Selons,Fashion,"Hoodie & Sweater",selons-knit-sweater,"uploads/2026-03-09_1773057566_69aeb61e8c1db_selons knit sweater.jpg",90,SEL-FAS-SWT-001,35,29,2026-03-01,2026-03-19,new_arrival,1,1,"<b>Knit Sweater</b><p>Soft knit sweater designed for comfort, layering, and everyday cold weather style.</p>","<b>Selons Knit Sweater</b><p>This sweater is made for comfortable seasonal wear with a warm fabric feel and simple versatile design. It works well for casual outfits, daily commuting, and layered styling during cooler days.</p><p>Pair it with jeans, trousers, or sneakers for a clean relaxed look.</p>","Selons Knit Sweater","Shop Selons Knit Sweater with soft fabric and comfortable everyday fit.","2024-03-16 09:37:00"
9,"Samsung Galaxy Tab S9 5G",Samsung,"Mobile Phones",Tablet,samsung-galaxy-tab-s9-5g,"uploads/2026-03-09_1773057876_69aeb754dc20d_samsung galaxy tab s9 5g.webp",35,SAM-MOB-TABS9-001,699,649,2026-03-01,2026-03-18,top,1,1,"<b>Tablet</b><p>High performance tablet designed for entertainment, study, and productivity on the go.</p>","<b>Samsung Galaxy Tab S9 5G</b><p>This tablet combines strong everyday performance with a portable design suitable for media viewing, note taking, work tasks, and online learning. It offers a large display, stable connectivity, and smooth user experience.</p><p>Ideal for users who want a flexible device between a smartphone and a laptop.</p>","Samsung Galaxy Tab S9 5G","Shop Samsung Galaxy Tab S9 5G for entertainment, study, and portable productivity.","2024-03-16 09:43:13"
10,"Xiaomi Y68 Smart Watch",Xiaomi,Electronics,"Smart Watch",xiaomi-y68-smart-watch,"uploads/2026-03-09_1773064221_69aed01d51bc1_xiaomi y68 smart watch.jpg",70,XIA-ELE-SMW-001,39,34,2026-03-01,2026-03-20,featured,1,1,"<b>Smart Watch</b><p>Affordable smart watch with fitness tracking, notifications, and lightweight daily comfort.</p>","<b>Xiaomi Y68 Smart Watch</b><p>This smart watch is designed for users who want essential health tracking, message alerts, and everyday wearable convenience. It offers a compact design suitable for casual use, basic activity monitoring, and daily routine support.</p><p>A practical option for customers looking for entry level smart wearable features at a friendly price.</p>","Xiaomi Y68 Smart Watch","Shop Xiaomi Y68 Smart Watch with fitness tracking and smart daily notifications.","2024-03-16 09:45:28"
11,"Sony Nintendo Switch Gaming Console",Sony,Electronics,"Gaming console",sony-nintendo-switch-gaming-console,"uploads/2026-03-09_1773064333_69aed08d72432_sony nintendo switch gaming console.jpg",30,SON-ELE-CON-001,299,279,2026-03-01,2026-03-15,best,1,1,"<b>Gaming Console</b><p>Portable gaming console built for entertainment, multiplayer fun, and smooth casual gameplay.</p>","<b>Sony Nintendo Switch Gaming Console</b><p>This gaming console is designed for flexible home and portable entertainment. It supports enjoyable gameplay, responsive controls, and a comfortable experience for casual and family gaming sessions.</p><p>A great option for players looking for convenient gaming performance and accessible entertainment features.</p>","Sony Nintendo Switch Gaming Console","Shop Sony Nintendo Switch Gaming Console for portable entertainment and smooth gameplay.","2024-03-16 09:49:54"
12,"Asus Mechanical Gaming Keyboard",Asus,"Computers & Laptops",Keyboard,asus-mechanical-gaming-keyboard,"uploads/2026-03-09_1773064577_69aed1813600b_asus mechanical gaming keyboard.jpg",65,ASU-CMP-KEY-001,89,79,2026-03-02,2026-03-20,featured,1,1,"<b>Gaming Keyboard</b><p>Responsive mechanical keyboard designed for gaming accuracy and comfortable typing.</p>","<b>Asus Mechanical Gaming Keyboard</b><p>This keyboard offers responsive key feel, stable performance, and a layout suitable for gaming sessions, office use, and everyday computer work. It provides comfortable input and dependable control for a smooth user experience.</p><p>Recommended for players and users who want accuracy, durability, and functional desktop performance.</p>","Asus Mechanical Gaming Keyboard","Shop Asus Mechanical Gaming Keyboard with responsive keys and smooth desktop performance.","2024-03-16 09:52:17"
13,"Asus Precision Gaming Mouse",Asus,"Computers & Laptops",Mouse,asus-precision-gaming-mouse,"uploads/2026-03-09_1773064704_69aed20055243_asus precision gaming mouse.webp",80,ASU-CMP-MSE-001,49,42,2026-03-02,2026-03-18,top,1,1,"<b>Gaming Mouse</b><p>High precision gaming mouse with smooth tracking and comfortable ergonomic grip.</p>","<b>Asus Precision Gaming Mouse</b><p>This gaming mouse is built for accurate movement, smooth cursor control, and everyday comfort during long sessions. It supports work, browsing, and gaming with a balanced ergonomic shape and dependable response.</p><p>A practical accessory for users who want performance and comfort in one desktop device.</p>","Asus Precision Gaming Mouse","Shop Asus Precision Gaming Mouse with smooth tracking and comfortable ergonomic design.","2024-03-16 09:55:17"
17,"Under Armour Hoodie With Cap","Under Armour",Fashion,"Hoodie & Sweater",under-armour-hoodie-with-cap,"uploads/2026-03-09_1773065490_69aed5126c1fc_under armour hoodie with cap.jpg",85,UAR-FAS-HOD-001,42,36,2026-03-01,2026-03-20,top,1,1,"<b>Hoodie</b><p>Comfortable hoodie with cap design for casual wear, layering, and cool weather comfort.</p>","<b>Under Armour Hoodie With Cap</b><p>This hoodie offers a soft feel, relaxed fit, and everyday comfort suitable for outdoor movement, casual outfits, and light seasonal layering. It combines a sporty look with practical warmth for daily wear.</p><p>Easy to pair with joggers, jeans, or sneakers for a modern casual style.</p>","Under Armour Hoodie With Cap","Shop Under Armour Hoodie With Cap for sporty comfort and everyday casual layering.","2024-03-20 06:53:16"
18,"Selons Casual Jacket",Selons,Fashion,"Vest & Blazer",selons-casual-jacket,"uploads/2026-03-09_1773065582_69aed56e79c72_selons casual jacket.jpg",70,SEL-FAS-JCK-001,55,49,2026-03-02,2026-03-20,featured,1,1,"<b>Casual Jacket</b><p>Lightweight jacket made for daily wear, easy layering, and clean modern styling.</p>","<b>Selons Casual Jacket</b><p>This jacket is designed for versatile everyday use with a simple structure and comfortable fit. It works well for casual outings, travel, and light layering during cooler mornings or evenings.</p><p>A practical fashion piece for customers who want easy styling and all day comfort.</p>","Selons Casual Jacket","Shop Selons Casual Jacket with lightweight comfort and easy everyday styling.","2024-03-20 06:57:43"
19,"Selons Classic Blue Jeans",Selons,Fashion,Jean,selons-classic-blue-jeans,"uploads/2026-03-09_1773065684_69aed5d400872_selons classic blue jeans.webp",95,SEL-FAS-JEA-001,48,42,2026-03-01,2026-03-19,top,1,1,"<b>Blue Jeans</b><p>Classic fit jeans designed for daily comfort, casual style, and versatile wear.</p>","<b>Selons Classic Blue Jeans</b><p>These jeans feature a timeless everyday look with balanced comfort and simple styling. They are suitable for work, travel, and casual daily outfits, making them a reliable wardrobe essential.</p><p>Easy to combine with t-shirts, sweaters, jackets, and sneakers for a clean casual appearance.</p>","Selons Classic Blue Jeans","Shop Selons Classic Blue Jeans for casual comfort and timeless everyday style.","2024-03-20 07:00:34"
20,"Selons Baggy Trousers",Selons,Fashion,Trouser,selons-baggy-trousers,"uploads/2026-03-09_1773065869_69aed68d25b2b_selons baggy trousers.webp",90,SEL-FAS-TRS-001,38,33,2026-03-01,2026-03-18,featured,1,1,"<b>Baggy Trousers</b><p>Relaxed fit trousers created for comfort, movement, and casual everyday styling.</p>","<b>Selons Baggy Trousers</b><p>These trousers offer a loose comfortable fit and easy casual styling for daily outfits. They are suitable for users who prefer breathable movement, relaxed silhouettes, and practical wear throughout the day.</p><p>A flexible option for pairing with t-shirts, hoodies, and casual sneakers.</p>","Selons Baggy Trousers","Shop Selons Baggy Trousers with relaxed fit and comfortable everyday wear.","2024-03-20 07:03:26"
21,"Selons Cotton Shorts",Selons,Fashion,Trouser,selons-cotton-shorts,"uploads/2026-03-09_1773066059_69aed74bf220c_selons cotton shorts.jpeg",85,SEL-FAS-SHO-001,24,20,2026-03-01,2026-03-17,new_arrival,1,1,"<b>Cotton Shorts</b><p>Comfortable casual shorts designed for daily wear, warm weather, and easy movement.</p>","<b>Selons Cotton Shorts</b><p>These shorts provide lightweight comfort and a clean casual look suitable for daily activities, travel, and relaxed weekend outfits. They are made for breathable wear and simple styling during warmer days.</p><p>A useful wardrobe option for users who want comfort and flexibility in casual fashion.</p>","Selons Cotton Shorts","Shop Selons Cotton Shorts with lightweight comfort and casual warm weather style.","2024-03-25 04:19:08"
22,"Samsung Galaxy Z Fold6 512GB Smartphone",Samsung,"Mobile Phones",Phone,samsung-galaxy-z-fold6-512gb-smartphone,"uploads/2026-03-09_1773066173_69aed7bd7f98b_samsung galaxy z fold6 512gb smartphone.jpg",25,SAM-MOB-ZFLD6-001,1599,1499,2026-03-01,2026-03-15,best,1,1,"<b>Foldable Smartphone</b><p>Premium foldable smartphone with large display, advanced AI features, and flagship performance.</p>","<b>Samsung Galaxy Z Fold6 512GB Smartphone</b><p>This foldable smartphone combines a large immersive display with powerful performance, premium build quality, and smart multitasking features. It is suitable for users who want productivity, entertainment, and advanced mobile technology in one device.</p><p>Designed for premium everyday use, content viewing, and modern multitasking workflows.</p>","Samsung Galaxy Z Fold6 512GB Smartphone","Shop Samsung Galaxy Z Fold6 512GB Smartphone with foldable display and premium flagship performance.","2025-06-30 16:23:58"
24,"Adidas Oversized Graphic T-Shirt",Adidas,Fashion,T-shirt,adidas-oversized-graphic-t-shirt,"uploads/2026-03-09_1773066301_69aed83d6f534_adidas oversized graphic t-shirt.jpg",100,ADI-FAS-TSH-002,28,22,2026-03-08,2026-03-30,featured,1,1,"<b>Adidas Oversized Graphic T-Shirt</b><p>Modern oversized cotton t-shirt with bold graphic print designed for casual streetwear and everyday comfort.</p>","<b>Adidas Oversized Graphic T-Shirt</b>  <p>This oversized graphic t-shirt from Adidas combines relaxed street style with breathable cotton fabric. The soft material ensures comfort while the loose silhouette offers a trendy urban look.</p>  <p><b>Features:</b></p>  <ul>  <li>100% breathable cotton fabric</li>  <li>Oversized relaxed fit</li>  <li>Bold Adidas graphic print</li>  <li>Perfect for casual and streetwear outfits</li>  </ul>","Adidas Oversized Graphic T-Shirt","Adidas oversized cotton graphic t-shirt designed for casual streetwear and daily comfort.","2026-03-08 10:37:14"
25,"Adidas Slim Fit Polo Shirt",Adidas,Fashion,Shirt,adidas-slim-fit-polo-shirt,"uploads/2026-03-09_1773066446_69aed8cedb5e7_adidas slim fit polo shirt.jpeg",80,ADI-FAS-POL-003,35,29,2026-03-08,2026-03-30,featured,1,1,"<b>Adidas Slim Fit Polo Shirt</b><p>Sporty slim fit polo shirt designed for casual and athletic wear.</p>","<b>Adidas Slim Fit Polo Shirt</b><p>This Adidas polo shirt combines sporty performance with modern style. The breathable fabric and tailored slim fit design make it perfect for both casual outings and light sports activities.</p>","Adidas Slim Fit Polo Shirt","Comfortable slim fit Adidas polo shirt for casual and sporty outfits.","2026-03-08 10:44:37"
26,"Puma Casual Street Hoodie",Puma,Fashion,"Hoodie & Sweater",puma-casual-street-hoodie,"uploads/2026-03-09_1773066537_69aed92935d8b_puma casual street hoodie-2.jpeg",60,PUM-FAS-HOD-004,45,38,2026-03-08,2026-03-30,featured,1,1,"<b>Puma Casual Street Hoodie</b><p>Comfortable streetwear hoodie designed for daily casual fashion.</p>","<b>Puma Casual Street Hoodie</b><p>This Puma hoodie offers soft fleece comfort with a relaxed streetwear style. Ideal for cool weather and everyday outfits.</p>","Puma Casual Street Hoodie","Puma fleece hoodie designed for casual everyday fashion.","2026-03-08 10:46:42"
27,"Nike Lightweight Windbreaker Jacket",Nike,Fashion,"Vest & Blazer",nike-lightweight-windbreaker-jacket,"uploads/2026-03-09_1773066660_69aed9a4083b2_nike lightweight windbreaker jacket-2.webp",50,NIK-FAS-JKT-005,70,60,2026-03-08,2026-03-30,featured,1,1,"<b>Nike Windbreaker Jacket</b><p>Lightweight jacket designed to protect against wind while staying breathable.</p>","<b>Nike Lightweight Windbreaker Jacket</b><p>This windbreaker jacket from Nike provides excellent comfort and wind protection while remaining lightweight and stylish.</p>","Nike Lightweight Windbreaker Jacket","Nike windbreaker jacket perfect for outdoor and casual wear.","2026-03-08 10:47:23"
28,"Reebok Training Jogger Pants",Reebok,Fashion,Trouser,reebok-training-jogger-pants,"uploads/2026-03-09_1773066763_69aeda0b11fd1_reebok training jogger pants.webp",75,REE-FAS-JOG-006,50,42,2026-03-08,2026-03-30,featured,1,1,"<b>Reebok Training Jogger Pants</b><p>Comfortable athletic jogger pants designed for workouts and casual wear.</p>","<b>Reebok Training Jogger Pants</b><p>These jogger pants feature flexible fabric and a tapered fit, providing comfort for training sessions and daily activities.</p>","Reebok Training Jogger Pants","Reebok athletic jogger pants for training and casual style.","2026-03-08 10:53:15"
29,"Under Armour Performance Training T-Shirt","Under Armour",Fashion,T-shirt,under-armour-performance-training-t-shirt,"uploads/2026-03-09_1773066900_69aeda940db89_under armour performance training t-shirt.webp",90,UA-FAS-TSH-007,32,26,2026-03-08,2026-03-30,featured,1,1,"<b>Under Armour Training T-Shirt</b><p>Performance t-shirt designed for workouts and active lifestyles.</p>","<b>Under Armour Performance Training T-Shirt</b><p>This lightweight athletic shirt features moisture-wicking fabric to keep you cool and comfortable during workouts.</p>","Under Armour Training T-Shirt","Under Armour athletic performance t-shirt designed for training.","2026-03-08 11:00:24"
30,"Adidas Streetwear Sweatshirt",Adidas,Fashion,"Hoodie & Sweater",adidas-streetwear-sweatshirt,"uploads/2026-03-09_1773067055_69aedb2f5f3f9_adidas streetwear sweatshirt-0.jpeg",85,ADI-FAS-SWT-008,42,36,2026-03-08,2026-03-30,featured,1,1,"<b>Adidas Streetwear Sweatshirt</b><p>Soft everyday sweatshirt with clean streetwear style and relaxed comfort.</p>","<b>Adidas Streetwear Sweatshirt</b><p>This sweatshirt combines casual comfort with a modern sporty look. The soft fabric and relaxed shape make it suitable for daily wear, cool evenings, and casual layering.</p><p>It pairs well with jeans, joggers, and sneakers for simple everyday fashion.</p>","Adidas Streetwear Sweatshirt","Shop Adidas Streetwear Sweatshirt with soft fabric and casual everyday comfort.","2026-03-08 11:23:57"
31,"Puma Slim Fit Denim Jeans",Puma,Fashion,Jean,puma-slim-fit-denim-jeans,"uploads/2026-03-09_1773067168_69aedba07a7a2_puma slim fit denim jeans.webp",70,PUM-FAS-JEA-009,58,49,2026-03-08,2026-03-29,top,1,1,"<b>Puma Slim Fit Denim Jeans</b><p>Modern slim fit jeans designed for casual wear and clean everyday style.</p>","<b>Puma Slim Fit Denim Jeans</b><p>These denim jeans feature a balanced slim fit and a versatile design for daily outfits. They are comfortable enough for regular wear and stylish enough for casual outings and weekend looks.</p><p>Easy to pair with t-shirts, polos, hoodies, and casual jackets.</p>","Puma Slim Fit Denim Jeans","Shop Puma Slim Fit Denim Jeans with casual style and comfortable everyday fit.","2026-03-08 11:23:57"
32,"Nike Sports Polo Shirt",Nike,Fashion,Shirt,nike-sports-polo-shirt,"uploads/2026-03-09_1773067294_69aedc1e3c8b3_nike sports polo shirt-2.png",75,NIK-FAS-POL-010,38,32,2026-03-08,2026-03-28,featured,1,1,"<b>Nike Sports Polo Shirt</b><p>Breathable polo shirt built for sporty comfort and polished casual outfits.</p>","<b>Nike Sports Polo Shirt</b><p>This polo shirt offers a clean sporty design with breathable fabric and comfortable fit. It works well for casual office days, weekend outings, and light outdoor activity.</p><p>A practical choice for customers who want comfort with a sharper everyday look.</p>","Nike Sports Polo Shirt","Shop Nike Sports Polo Shirt with breathable comfort and clean sporty style.","2026-03-08 11:23:57"
33,"Reebok Casual Pullover Hoodie",Reebok,Fashion,"Hoodie & Sweater",reebok-casual-pullover-hoodie,"uploads/2026-03-09_1773067903_69aede7f27ddb_reebok casual pullover hoodie.jpg",60,REE-FAS-HOD-011,46,39,2026-03-08,2026-03-30,featured,1,1,"<b>Reebok Casual Pullover Hoodie</b><p>Warm pullover hoodie designed for daily comfort and relaxed streetwear style.</p>","<b>Reebok Casual Pullover Hoodie</b><p>This hoodie delivers soft warmth and practical comfort for daily wear. Its relaxed fit and classic pullover style make it ideal for layering during cool weather and casual movement throughout the day.</p><p>Works well with joggers, denim, and sneakers for an easy sporty outfit.</p>","Reebok Casual Pullover Hoodie","Shop Reebok Casual Pullover Hoodie for soft comfort and relaxed everyday streetwear.","2026-03-08 11:23:57"
34,"Under Armour Athletic Shorts","Under Armour",Fashion,Trouser,under-armour-athletic-shorts,"uploads/2026-03-09_1773068193_69aedfa138249_under armour athletic shorts.jpg",95,UAR-FAS-SHO-012,30,25,2026-03-08,2026-03-27,new_arrival,1,1,"<b>Under Armour Athletic Shorts</b><p>Lightweight training shorts made for movement, comfort, and active everyday wear.</p>","<b>Under Armour Athletic Shorts</b><p>These athletic shorts are designed for workouts, jogging, and casual movement with lightweight fabric and comfortable structure. They provide flexibility and breathable wear for training sessions and active routines.</p><p>A solid option for fitness-focused customers and sporty casual use.</p>","Under Armour Athletic Shorts","Shop Under Armour Athletic Shorts with lightweight comfort and active performance design.","2026-03-08 11:23:57"
35,"Adidas Urban Bomber Jacket",Adidas,Fashion,"Vest & Blazer",adidas-urban-bomber-jacket,"uploads/2026-03-09_1773068241_69aedfd130c04_adidas urban bomber jacket.webp",55,ADI-FAS-JCK-013,78,68,2026-03-08,2026-03-30,best,1,1,"<b>Adidas Urban Bomber Jacket</b><p>Light bomber jacket with sporty urban style and comfortable everyday layering.</p>","<b>Adidas Urban Bomber Jacket</b><p>This bomber jacket blends sporty detail with a modern city look. It is lightweight enough for daily wear and practical enough for transitional weather and casual layering.</p><p>Ideal for pairing with jeans, t-shirts, and sneakers for a clean street-inspired outfit.</p>","Adidas Urban Bomber Jacket","Shop Adidas Urban Bomber Jacket with lightweight comfort and modern streetwear style.","2026-03-08 11:23:57"
36,"Puma Lightweight Zip Hoodie",Puma,Fashion,"Hoodie & Sweater",puma-lightweight-zip-hoodie,"uploads/2026-03-09_1773068340_69aee0341f421_puma lightweight zip hoodie 2.jpeg",68,PUM-FAS-HOD-014,44,37,2026-03-08,2026-03-26,featured,1,1,"<b>Puma Lightweight Zip Hoodie</b><p>Versatile zip hoodie designed for layering, movement, and casual daily comfort.</p>","<b>Puma Lightweight Zip Hoodie</b><p>This zip hoodie is made for easy layering and relaxed daily style. The lightweight build makes it useful for morning walks, casual trips, and everyday comfort without feeling heavy.</p><p>A flexible fashion item for users who want sporty practicality in daily outfits.</p>","Puma Lightweight Zip Hoodie","Shop Puma Lightweight Zip Hoodie with sporty comfort and practical everyday layering.","2026-03-08 11:23:57"
37,"Nike Everyday Crewneck Sweatshirt",Nike,Fashion,"Hoodie & Sweater",nike-everyday-crewneck-sweatshirt,"uploads/2026-03-09_1773068461_69aee0add2b32_nike everyday crewneck sweatshirt.jpg",72,NIK-FAS-SWT-015,40,34,2026-03-08,2026-03-28,top,1,1,"<b>Nike Everyday Crewneck Sweatshirt</b><p>Classic crewneck sweatshirt with soft fabric and easy casual everyday style.</p>","<b>Nike Everyday Crewneck Sweatshirt</b><p>This sweatshirt offers simple everyday comfort with a timeless crewneck shape and soft material feel. It is suitable for layering, casual wear, and comfortable indoor or outdoor use during cooler weather.</p><p>A dependable wardrobe essential for modern relaxed fashion.</p>","Nike Everyday Crewneck Sweatshirt","Shop Nike Everyday Crewneck Sweatshirt with soft comfort and classic casual style.","2026-03-08 11:23:57"
38,"Under Armour Performance Polo Shirt","Under Armour",Fashion,Shirt,under-armour-performance-polo-shirt,"uploads/2026-03-09_1773068606_69aee13e65cef_under armour performance polo shirt.jpg",64,UAR-FAS-POL-016,39,33,2026-03-08,2026-03-29,featured,1,1,"<b>Under Armour Performance Polo Shirt</b><p>Performance polo shirt designed for active comfort and clean smart-casual wear.</p>","<b>Under Armour Performance Polo Shirt</b><p>This polo shirt combines athletic functionality with a refined casual appearance. The breathable structure supports movement and comfort while maintaining a polished look for work, travel, or light sport activity.</p><p>A practical product for users who want comfort and versatility in one shirt.</p>","Under Armour Performance Polo Shirt","Shop Under Armour Performance Polo Shirt with breathable comfort and smart-casual style.","2026-03-08 11:23:57"
39,"Reebok Straight Fit Denim Jeans",Reebok,Fashion,Jean,reebok-straight-fit-denim-jeans,"uploads/2026-03-09_1773068677_69aee1851e289_reebok straight fit denim jeans.jpeg",66,REE-FAS-JEA-017,54,46,2026-03-08,2026-03-27,top,1,1,"<b>Reebok Straight Fit Denim Jeans</b><p>Comfortable straight fit jeans made for casual daily outfits and easy styling.</p>","<b>Reebok Straight Fit Denim Jeans</b><p>These jeans feature a clean straight fit that balances comfort and classic casual design. They are suitable for everyday wear, social outings, and practical wardrobe rotation.</p><p>Easy to style with polos, sweatshirts, hoodies, and sneakers.</p>","Reebok Straight Fit Denim Jeans","Shop Reebok Straight Fit Denim Jeans with casual comfort and classic everyday design.","2026-03-08 11:23:57"
40,"Nike Relaxed Fit Chino Trousers",Nike,Fashion,Trouser,nike-relaxed-fit-chino-trousers,"uploads/2026-03-09_1773068794_69aee1fa54c10_nike relaxed fit chino trousers.jpg",70,NIK-FAS-TRS-018,47,40,2026-03-08,2026-03-28,new_arrival,1,1,"<b>Nike Relaxed Fit Chino Trousers</b><p>Comfortable chino trousers designed for relaxed movement and versatile everyday wear.</p>","<b>Nike Relaxed Fit Chino Trousers</b><p>These chino trousers offer a clean casual appearance with a comfortable relaxed fit. They are suitable for work, travel, and daily outfits where comfort and simple style both matter.</p><p>They match well with t-shirts, polos, shirts, and casual jackets.</p>","Nike Relaxed Fit Chino Trousers","Shop Nike Relaxed Fit Chino Trousers with casual comfort and versatile everyday styling.","2026-03-08 11:23:57"
41,"Puma Essential Crew T-Shirt",Puma,Fashion,T-shirt,puma-essential-crew-t-shirt,"uploads/2026-03-09_1773068877_69aee24dd2d7e_puma essential crew t-shirt.webp",105,PUM-FAS-TSH-019,24,19,2026-03-08,2026-03-26,top,1,1,"<b>Puma Essential Crew T-Shirt</b><p>Everyday crew neck t-shirt with soft cotton feel and clean casual design.</p>","<b>Puma Essential Crew T-Shirt</b><p>This t-shirt is made for daily comfort with a straightforward design and breathable fabric feel. It works well for casual outfits, travel, and warm weather wear.</p><p>A reliable fashion basic that fits easily into everyday wardrobes.</p>","Puma Essential Crew T-Shirt","Shop Puma Essential Crew T-Shirt with soft cotton comfort and simple everyday style.","2026-03-08 11:23:57"
